Code,Libellé
K64.99,"Autres activités des services financiers, hors assurance et caisses de retraite, n.c.a."
K65.11,Assurance vie
K65.12,Autres assurances
K65.20,Réassurance
K65.30,Caisses de retraite
K66.11,Administration de marchés financiers
K66.12,Courtage de valeurs mobilières et de marchandises
K66.19,"Autres activités auxiliaires de services financiers, hors assurance et caisses de retraite"
K66.21,Évaluation des risques et dommages
K66.22,Activités des agents et courtiers d'assurances
K66.29,Autres activités auxiliaires d'assurance et de caisses de retraite
K66.30,Gestion de fonds
L68.10,Activités des marchands de biens immobiliers
L68.20,Location et exploitation de biens immobiliers propres ou loués
L68.31,Agences immobilières
L68.32,Administration de biens immobiliers
M69.10,Activités juridiques
M69.20,Activités comptables
M70.10,Activités des sièges sociaux
M70.21,Conseil en relations publiques et communication
M70.22,Conseil pour les affaires et autres conseils de gestion
M71.11,Activités d'architecture
M71.12,Activités d'ingénierie
M71.20,Activités de contrôle et analyses techniques
M72.11,Recherche-développement en biotechnologie
M72.19,Recherche-développement en autres sciences physiques et naturelles
M72.20,Recherche-développement en sciences humaines et sociales
M73.11,Activités des agences de publicité
M73.12,Régie publicitaire de médias
M73.20,Études de marché et sondages
M74.10,Activités spécialisées de design
M74.20,Activités photographiques
M74.30,Traduction et interprétation
M74.90,"Autres activités spécialisées, scientifiques et techniques n.c.a."
M75.00,Activités vétérinaires
N77.11,Location et location-bail de voitures et de véhicules automobiles légers
N77.12,Location et location-bail de camions
N77.21,Location et location-bail d'articles de loisirs et de sport
N77.22,Location de vidéocassettes et disques vidéo
N77.29,Location et location-bail d'autres biens personnels et domestiques
N77.31,Location et location-bail de machines et équipements agricoles
N77.32,Location et location-bail de machines et équipements pour la construction
N77.33,Location et location-bail de machines de bureau et de matériel informatique
N77.34,Location et location-bail de matériels de transport par eau
N77.35,Location et location-bail de matériels de transport aérien
N77.39,"Location et location-bail d'autres machines, équipements et biens matériels n.c.a."
N77.40,"Location-bail de propriété intellectuelle et de produits similaires, à l'exception des œuvres soumises à copyright"
N78.10,Activités des agences de placement de main-d'œuvre
N78.20,Activités des agences de travail temporaire
N78.30,Autre mise à disposition de ressources humaines
N79.11,Activités des agences de voyage
N79.12,Activités des voyagistes
N79.90,Autres services de réservation et activités connexes
N80.10,Activités de sécurité privée
N80.20,Activités liées aux systèmes de sécurité
N80.30,Activités d'enquête
N81.10,Activités combinées de soutien lié aux bâtiments
N81.21,Nettoyage courant des bâtiments
N81.22,Autres activités de nettoyage des bâtiments et nettoyage industriel
N81.29,Autres activités de nettoyage
N81.30,Services d'aménagement paysager
N82.11,Services administratifs combinés de bureau
N82.19,"Photocopie, préparation de documents et autres activités spécialisées de soutien de bureau"
N82.20,Activités de centres d'appels
N82.30,Organisation de salons professionnels et congrès
N82.91,Activités des agences de recouvrement de factures et des sociétés d'information financière sur la clientèle
N82.92,Activités de conditionnement
N82.99,Autres activités de soutien aux entreprises n.c.a.
O84.11,Administration publique générale
O84.12,"Administration publique (tutelle) de la santé, de la formation, de la culture et des services sociaux, autre que sécurité sociale"
O84.13,Administration publique (tutelle) des activités économiques
O84.21,Affaires étrangères
O84.22,Défense
O84.23,Justice
O84.24,Activités d'ordre public et de sécurité
O84.25,Services du feu et de secours
O84.30,Sécurité sociale obligatoire
P85.10,Enseignement pré-primaire
P85.20,Enseignement primaire
P85.31,Enseignement secondaire général
P85.32,Enseignement secondaire technique ou professionnel
P85.41,Enseignement post-secondaire non supérieur
P85.42,Enseignement supérieur
P85.51,Enseignement de disciplines sportives et d'activités de loisirs
P85.52,Enseignement culturel
P85.53,Enseignement de la conduite
P85.59,Enseignements divers
P85.60,Activités de soutien à l'enseignement
Q86.10,Activités hospitalières
Q86.21,Activité des médecins généralistes
Q86.22,Activité des médecins spécialistes
Q86.23,Pratique dentaire
Q86.90,Autres activités pour la santé humaine
Q87.10,Hébergement médicalisé
Q87.20,"Hébergement social pour personnes handicapées mentales, malades mentales et toxicomanes"
Q87.30,Hébergement social pour personnes âgées ou handicapées physiques
Q87.90,Autres activités d'hébergement social
Q88.10,Action sociale sans hébergement pour personnes âgées et pour personnes handicapées
Q88.91,Action sociale sans hébergement pour jeunes enfants
Q88.99,Autre action sociale sans hébergement n.c.a.
R90.01,Arts du spectacle vivant
R90.02,Activités de soutien au spectacle vivant
R90.03,Création artistique
R90.04,Gestion de salles de spectacles
R91.01,Gestion des bibliothèques et des archives
R91.02,Gestion des musées
R91.03,Gestion des sites et monuments historiques et des attractions touristiques similaires
R91.04,Gestion des jardins botaniques et zoologiques et des réserves naturelles
R92.00,Organisation de jeux de hasard et d'argent
R93.11,Gestion d'installations sportives
R93.12,Activités de clubs de sports
R93.13,Activités des centres de culture physique
R93.19,Autres activités liées au sport
R93.21,Activités des parcs d'attractions et parcs à thèmes
R93.29,Autres activités récréatives et de loisirs
S94.11,Activités des organisations patronales et consulaires
S94.12,Activités des organisations professionnelles
S94.20,Activités des syndicats de salariés
S94.91,Activités des organisations religieuses
S94.92,Activités des organisations politiques
S94.99,Activités des organisations associatives n.c.a.
S95.11,Réparation d'ordinateurs et d'équipements périphériques
S95.12,Réparation d'équipements de communication
S95.21,Réparation de produits électroniques grand public
S95.22,Réparation d'appareils électroménagers et d'équipements pour la maison et le jardin
S95.23,Réparation de chaussures et d'articles en cuir
S95.24,Réparation de meubles et d'équipements du foyer
S95.25,Réparation d'articles d'horlogerie et de bijouterie
S95.29,Réparation d'autres biens personnels et domestiques
S96.01,Blanchisserie-teinturerie
S96.02,Coiffure et soins de beauté
S96.03,Services funéraires
S96.04,Entretien corporel
S96.09,Autres services personnels n.c.a.
T97.00,Activités des ménages en tant qu'employeurs de personnel domestique
T98.10,Activités indifférenciées des ménages en tant que producteurs de biens pour usage propre
T98.20,Activités indifférenciées des ménages en tant que producteurs de services pour usage propre
U99.00,Activités des organisations et organismes extraterritoriaux
